Date,Day,Commits,Category,Key Work Completed,Tokens Used (Est),Notes & Milestones
2025-10-14,Mon,1,Setup,Sync live server to GitHub - Project foundation,2000,Project repository created
2025-10-15,Tue,2,Backend,"Provider architecture, env loading, MongoDB auth, demo email/maps",15000,MILESTONE: Extensible provider pattern established
2025-10-21,Mon,1,Backend,"Root redirect, provider cleanup",3000,Code cleanup and organization
2025-10-22,Tue,3,Backend,"MongoDB setup, Google Maps, migrate to production providers (SendGrid, Twilio, Stripe)",10000,MILESTONE: Production integrations complete
2025-10-23,Wed,2,Backend,"All third-party services integrated, working login flow with token persistence",8000,All major third-party services functional
2025-11-04,Mon,2,Frontend,"Photo upload debug endpoint, login error handling improvements",10000,Photo upload issues identified
2025-11-05,Tue,13,Deployment,"Deployment prep: dependencies, gitignore, API client configuration, Metro cache cleanup",12000,Ready for deployment
2025-11-06,Wed,6,Frontend,"Design system theme constants, reusable UI components, contractor registration flow (4 steps), deployment docs",12000,MILESTONE: UI foundation and contractor flow
2025-11-10,Sun,48,Dashboard,"CONTRACTOR DASHBOARD: 40+ React Native components, job management (5 statuses), photo gallery, expenses, mileage, tax reporting + LINODE STORAGE FIX",42000,BIGGEST DAY: Dashboard complete + Critical bug fixed
2025-11-11,Mon,6,Bug Fixes,"iPhone photo upload fixes: iOS FormData file:// prefix, removed duplicate upload logic, added photo thumbnails to UI",12000,iOS platform-specific fixes complete
