Metric,Value,Notes
Project Duration,"29 days (Oct 14 - Nov 11, 2025)",4 weeks from foundation to production
Total Commits,84 commits,Mix of manual and AI-generated commits
Active Development Days,10 active days,Highly focused development sessions
Total Tokens Used (Estimated),"100,000 - 120,000 tokens",Includes all debugging and documentation
Tokens Wasted (Estimated),"~25,000 tokens (20-25%)",Could reduce by 25% with upfront checks
Token Efficiency,75-80% efficient,Strong efficiency with room for improvement
Bugs Tracked,3 major bugs documented,Detailed lessons learned for each
Critical Bugs Fixed,1 (Linode storage boto3 checksums),Took ~30K tokens but critical blocker
Backend Status,Deployed ✅ Production-ready,systemd service active and enabled
Frontend Status,Complete ⏳ Ready for backend integration,Awaiting backend API implementation
Documentation Files Created,6 major .md files + bug tracker,Comprehensive knowledge base
React Native Components,40+ production-ready components,Full contractor dashboard in 1 day
Provider Integrations,"6 (MongoDB, Linode, SendGrid, Twilio, Stripe, Google Maps)",All functional and production-ready
API Endpoints,15+ RESTful endpoints,"Authentication, quotes, photos, health"
Database Collections,"5 (users, user_passwords, services, quotes, planned: jobs/expenses/mileage)",MongoDB Atlas cluster connected
Production Server,172.234.70.157:8001,Running uvicorn with 8 workers
Object Storage,photos.us-iad-10.linodeobjects.com ✅ Working,boto3 with AWS_REQUEST_CHECKSUM_CALCULATION
Health Endpoint,/api/health returning healthy status ✅,"Verifies DB, storage, and service status"
